{
  "$schema": "https://json-schema.org/draft/2020-12/schema",
  "$id": "audit_result.schema.json",
  "title": "Audit Result",
  "type": "object",
  "required": [
    "task_id",
    "unit_id",
    "pass_id",
    "lens",
    "file_coverage",
    "findings"
  ],
  "$defs": {
    "Finding": {
      "$ref": "finding.schema.json"
    },
    "AuditTask": {
      "$ref": "audit_task.schema.json"
    }
  },
  "properties": {
    "task_id": { "type": "string" },
    "unit_id": { "type": "string" },
    "pass_id": { "type": "string" },
    "lens": {
      "type": "string",
      "enum": ["correctness", "architecture", "maintainability", "security", "reliability", "performance", "data_integrity", "tests", "operability", "config_deployment", "observability"]
    },
    "agent_role": { "type": "string" },
    "file_coverage": {
      "type": "array",
      "minItems": 1,
      "items": {
        "type": "object",
        "required": ["path", "total_lines"],
        "properties": {
          "path": { "type": "string" },
          "total_lines": { "type": "integer", "minimum": 0 }
        },
        "additionalProperties": false
      }
    },
    "findings": {
      "type": "array",
      "items": { "$ref": "#/$defs/Finding" }
    },
    "notes": {
      "type": "array",
      "items": { "type": "string" }
    },
    "requires_followup": { "type": "boolean" },
    "followup_tasks": {
      "type": "array",
      "items": { "type": "string" }
    },
    "verification": {
      "type": "object",
      "required": ["verified", "needs_followup"],
      "properties": {
        "verified": { "type": "boolean" },
        "needs_followup": { "type": "boolean" },
        "concerns": {
          "type": "array",
          "items": { "type": "string" }
        },
        "coverage_concerns": {
          "type": "array",
          "items": { "type": "string" }
        },
        "confidence_concerns": {
          "type": "array",
          "items": { "type": "string" }
        },
        "followup_tasks": {
          "type": "array",
          "items": { "$ref": "#/$defs/AuditTask" }
        }
      },
      "additionalProperties": false
    }
  },
  "additionalProperties": false
}
