[
  {
    "task_id": "packages-audit-code:config_deployment:part-1",
    "unit_id": "packages-audit-code",
    "pass_id": "pass:config_deployment",
    "lens": "config_deployment",
    "file_coverage": [
      {"path":"packages/audit-code/.github/workflows/ci.yml","total_lines":95},
      {"path":"packages/audit-code/.github/workflows/packaged-entrypoint.yml","total_lines":91},
      {"path":"packages/audit-code/.github/workflows/product-e2e.yml","total_lines":98},
      {"path":"packages/audit-code/.github/workflows/publish-package.yml","total_lines":179},
      {"path":"packages/audit-code/scripts/postinstall.mjs","total_lines":433},
      {"path":"packages/audit-code/scripts/release-and-publish.mjs","total_lines":296},
      {"path":"packages/audit-code/scripts/smoke-linked-audit-code.mjs","total_lines":733},
      {"path":"packages/audit-code/scripts/smoke-packaged-audit-code.mjs","total_lines":1021}
    ],
    "findings": [
      {
        "id": "CD-001",
        "title": "Missing push trigger on main branch for critical CI workflows",
        "category": "wrong-triggers",
        "severity": "medium",
        "confidence": "high",
        "lens": "config_deployment",
        "summary": "The packaged-entrypoint and product-e2e workflows only trigger on pull requests and workflow dispatches, meaning they will not automatically run when code is merged to the main branch.",
        "affected_files": [
          {
            "path": "packages/audit-code/.github/workflows/packaged-entrypoint.yml",
            "line_start": 3,
            "line_end": 16
          },
          {
            "path": "packages/audit-code/.github/workflows/product-e2e.yml",
            "line_start": 3,
            "line_end": 16
          }
        ],
        "evidence": [
          "packages/audit-code/.github/workflows/packaged-entrypoint.yml:3 - The 'on:' block specifies workflow_dispatch and pull_request but omits a push event trigger for the main branch, leaving main branch commits untested post-merge.",
          "packages/audit-code/.github/workflows/product-e2e.yml:3 - Similarly, the 'on:' block is missing a push event trigger for the main branch."
        ]
      },
      {
        "id": "CD-002",
        "title": "Concurrency group in publish workflow allows parallel deployments",
        "category": "deployment-safety",
        "severity": "medium",
        "confidence": "high",
        "lens": "config_deployment",
        "summary": "The publish-package workflow uses github.ref in its concurrency group, meaning simultaneous releases for different tags will run in parallel rather than queueing.",
        "affected_files": [
          {
            "path": "packages/audit-code/.github/workflows/publish-package.yml",
            "line_start": 28,
            "line_end": 30
          }
        ],
        "evidence": [
          "packages/audit-code/.github/workflows/publish-package.yml:29 - 'group: publish-${{ github.workflow }}-${{ github.ref }}' scopes concurrency by tag. Concurrent publishes for different tags will not be serialized, risking race conditions during npm publish."
        ]
      },
      {
        "id": "CD-003",
        "title": "Floating version pin for npm installation in publish workflow",
        "category": "floating-version-pins",
        "severity": "low",
        "confidence": "high",
        "lens": "config_deployment",
        "summary": "The publish workflow installs npm using a floating version pin (^11.5.1), which could break the deployment pipeline if a regression is introduced in a minor or patch update.",
        "affected_files": [
          {
            "path": "packages/audit-code/.github/workflows/publish-package.yml",
            "line_start": 61,
            "line_end": 67
          }
        ],
        "evidence": [
          "packages/audit-code/.github/workflows/publish-package.yml:67 - 'npm install -g npm@^11.5.1' uses a caret range rather than an exact version or SHA pin."
        ]
      }
    ]
  },
  {
    "task_id": "packages-audit-code:config_deployment:part-2",
    "unit_id": "packages-audit-code",
    "pass_id": "pass:config_deployment",
    "lens": "config_deployment",
    "file_coverage": [
      {"path":"packages/audit-code/scripts/update-languages.mjs","total_lines":71},
      {"path":"packages/audit-code/skills/audit-code/agents/openai.yaml","total_lines":4}
    ],
    "findings": []
  }
]
