[
  {
    "task_id": "tests-tiny-files:security",
    "unit_id": "tests-tiny-files",
    "pass_id": "pass:security",
    "lens": "security",
    "file_coverage": [
      {
        "path": "packages/audit-code/tests/graph-framework-routes.test.mjs",
        "total_lines": 173
      }
    ],
    "findings": []
  },
  {
    "task_id": "flow:flow:surface:packages-audit-code--gemini-commands-audit-code-toml:correctness",
    "unit_id": "flow:flow:surface:packages-audit-code--gemini-commands-audit-code-toml",
    "pass_id": "flow-pass:correctness",
    "lens": "correctness",
    "file_coverage": [
      {
        "path": "packages/audit-code/.gemini/commands/audit-code.toml",
        "total_lines": 53
      }
    ],
    "findings": []
  },
  {
    "task_id": "flow:flow:surface:packages-audit-code-skills-audit-code-opencode-command-template-txt:correctness",
    "unit_id": "flow:flow:surface:packages-audit-code-skills-audit-code-opencode-command-template-txt",
    "pass_id": "flow-pass:correctness",
    "lens": "correctness",
    "file_coverage": [
      {
        "path": "packages/audit-code/skills/audit-code/opencode-command-template.txt",
        "total_lines": 13
      }
    ],
    "findings": []
  },
  {
    "task_id": "flow:flow:surface:packages-audit-code-src-cli-args-ts:correctness",
    "unit_id": "flow:flow:surface:packages-audit-code-src-cli-args-ts",
    "pass_id": "flow-pass:correctness",
    "lens": "correctness",
    "file_coverage": [
      {
        "path": "packages/audit-code/src/cli/args.ts",
        "total_lines": 331
      }
    ],
    "findings": []
  },
  {
    "task_id": "flow:flow:surface:packages-audit-code-src-cli-dispatch-ts:correctness",
    "unit_id": "flow:flow:surface:packages-audit-code-src-cli-dispatch-ts",
    "pass_id": "flow-pass:correctness",
    "lens": "correctness",
    "file_coverage": [
      {
        "path": "packages/audit-code/src/cli/dispatch.ts",
        "total_lines": 726
      }
    ],
    "findings": [
      {
        "id": "COR-001",
        "title": "Hardcoded path to audit-code binary in submit command",
        "category": "logic-error",
        "severity": "high",
        "confidence": "high",
        "lens": "correctness",
        "summary": "The submitCommand in prepareDispatchArtifacts hardcodes the execution path to `node packages/audit-code/audit-code.mjs`, which will fail when auditing any repository other than the auditor-lambda repository itself.",
        "affected_files": [
          {
            "path": "packages/audit-code/src/cli/dispatch.ts",
            "line_start": 538,
            "line_end": 539
          }
        ],
        "evidence": [
          "packages/audit-code/src/cli/dispatch.ts:538 - `const submitCommand = 'node packages/audit-code/audit-code.mjs submit-packet ' ...` hardcodes the script path instead of using the generic `audit-code` executable."
        ]
      },
      {
        "id": "COR-002",
        "title": "Missing explicit provider propagation in prepareDispatchArtifacts",
        "category": "logic-error",
        "severity": "medium",
        "confidence": "high",
        "lens": "correctness",
        "summary": "prepareDispatchArtifacts ignores any explicit provider passed to the CLI by passing undefined to resolveFreshSessionProviderName.",
        "affected_files": [
          {
            "path": "packages/audit-code/src/cli/dispatch.ts",
            "line_start": 642,
            "line_end": 642
          }
        ],
        "evidence": [
          "packages/audit-code/src/cli/dispatch.ts:642 - `const quotaProviderName = resolveFreshSessionProviderName(undefined, sessionConfig);` explicitly passes `undefined` instead of taking a provider parameter from the caller."
        ]
      }
    ]
  },
  {
    "task_id": "flow:flow:surface:packages-audit-code-src-cli-prompts-ts:correctness",
    "unit_id": "flow:flow:surface:packages-audit-code-src-cli-prompts-ts",
    "pass_id": "flow-pass:correctness",
    "lens": "correctness",
    "file_coverage": [
      {
        "path": "packages/audit-code/src/cli/prompts.ts",
        "total_lines": 271
      }
    ],
    "findings": []
  },
  {
    "task_id": "flow:flow:surface:packages-audit-code-src-cli-steps-ts:correctness",
    "unit_id": "flow:flow:surface:packages-audit-code-src-cli-steps-ts",
    "pass_id": "flow-pass:correctness",
    "lens": "correctness",
    "file_coverage": [
      {
        "path": "packages/audit-code/src/cli/steps.ts",
        "total_lines": 70
      }
    ],
    "findings": []
  }
]
