[
  {
    "task_id": "packages-remediate-code:observability:part-3",
    "unit_id": "packages-remediate-code",
    "pass_id": "pass:observability",
    "lens": "observability",
    "file_coverage": [
      {"path":"packages/remediate-code/src/quota/scheduler.ts","total_lines":169},
      {"path":"packages/remediate-code/src/state/closingActions.ts","total_lines":11},
      {"path":"packages/remediate-code/src/state/store.ts","total_lines":184},
      {"path":"packages/remediate-code/src/state/types.ts","total_lines":110},
      {"path":"packages/remediate-code/src/steps/dispatch.ts","total_lines":766},
      {"path":"packages/remediate-code/src/steps/intakeResolver.ts","total_lines":270},
      {"path":"packages/remediate-code/src/steps/nextStep.ts","total_lines":1461}
    ],
    "findings": [
      {
        "id": "OBS-001",
        "title": "Use of console and stderr instead of structured logging",
        "category": "missing-telemetry-context",
        "severity": "medium",
        "confidence": "high",
        "lens": "observability",
        "summary": "State handling and dispatch steps write directly to console.log/warn or process.stderr, bypassing structured logging and omitting context like runId or timestamps.",
        "affected_files": [
          {"path": "packages/remediate-code/src/steps/dispatch.ts", "symbol": "prepareDocumentDispatch"},
          {"path": "packages/remediate-code/src/steps/nextStep.ts"},
          {"path": "packages/remediate-code/src/state/store.ts"}
        ],
        "evidence": [
          "packages/remediate-code/src/steps/dispatch.ts:384 - `console.log(\"Reusing existing document result...\")` skips the logger.",
          "packages/remediate-code/src/steps/dispatch.ts:610 - Uses `process.stderr.write` to report worktree creation errors instead of emitting a telemetry event.",
          "packages/remediate-code/src/state/store.ts:148 - Uses `console.warn` for lock closure failures instead of a context-aware logger."
        ]
      },
      {
        "id": "OBS-002",
        "title": "Silently swallowed errors drop observability context",
        "category": "swallowed-errors",
        "severity": "medium",
        "confidence": "high",
        "lens": "observability",
        "summary": "Multiple try-catch blocks silently swallow errors (e.g., JSON parse failures, file access errors) without recording them in telemetry, making it difficult to observe why operations failed.",
        "affected_files": [
          {"path": "packages/remediate-code/src/steps/dispatch.ts", "symbol": "tryLoadExistingDocumentResult"},
          {"path": "packages/remediate-code/src/steps/dispatch.ts", "symbol": "tryLoadExistingImplementResult"},
          {"path": "packages/remediate-code/src/steps/intakeResolver.ts", "symbol": "shouldTryAuditFastPath"}
        ],
        "evidence": [
          "packages/remediate-code/src/steps/dispatch.ts:53 - `catch { return false; }` in `tryLoadExistingDocumentResult` drops errors from `readJsonFile` or validation without any debug logs.",
          "packages/remediate-code/src/steps/intakeResolver.ts - `shouldTryAuditFastPath` has a `catch { parsed = undefined; }` that swallows JSON parsing errors for input files, hiding malformed input cases."
        ]
      },
      {
        "id": "OBS-003",
        "title": "Insufficient context on thrown errors",
        "category": "missing-error-context",
        "severity": "low",
        "confidence": "high",
        "lens": "observability",
        "summary": "Validation and state loading logic throws generic Errors without including contextual diagnostic details that would aid in troubleshooting.",
        "affected_files": [
          {"path": "packages/remediate-code/src/steps/dispatch.ts", "symbol": "loadStateOrThrow"},
          {"path": "packages/remediate-code/src/steps/dispatch.ts", "symbol": "validateImplementWorkerResult"}
        ],
        "evidence": [
          "packages/remediate-code/src/steps/dispatch.ts:338 - `throw new Error(\"Cannot prepare document dispatch without plan and items.\")` doesn't include the run ID or state status.",
          "packages/remediate-code/src/steps/dispatch.ts:641 - `throw new Error(\"Implement worker result must be an object.\")` lacks context about which result path or task caused the validation failure."
        ]
      }
    ]
  },
  {
    "task_id": "packages-remediate-code:observability:part-4",
    "unit_id": "packages-remediate-code",
    "pass_id": "pass:observability",
    "lens": "observability",
    "file_coverage": [
      {"path":"packages/remediate-code/src/steps/stepWriter.ts","total_lines":68},
      {"path":"packages/remediate-code/src/steps/types.ts","total_lines":133},
      {"path":"packages/remediate-code/src/steps/waveScheduler.ts","total_lines":149},
      {"path":"packages/remediate-code/src/steps/worktreeIsolation.ts","total_lines":138},
      {"path":"packages/remediate-code/src/types/disposition.ts","total_lines":17},
      {"path":"packages/remediate-code/src/types/externalAnalyzer.ts","total_lines":20},
      {"path":"packages/remediate-code/src/types/flows.ts","total_lines":19},
      {"path":"packages/remediate-code/src/types/graph.ts","total_lines":20},
      {"path":"packages/remediate-code/src/types/risk.ts","total_lines":10},
      {"path":"packages/remediate-code/src/types/runLedger.ts","total_lines":24},
      {"path":"packages/remediate-code/src/types/surfaces.ts","total_lines":17},
      {"path":"packages/remediate-code/src/types/workerResult.ts","total_lines":33},
      {"path":"packages/remediate-code/src/types/workerSession.ts","total_lines":77},
      {"path":"packages/remediate-code/src/utils/commands.ts","total_lines":43},
      {"path":"packages/remediate-code/src/utils/fileIntegrity.ts","total_lines":73}
    ],
    "findings": [
      {
        "id": "OBS-004",
        "title": "Silently swallowed errors drop observability context",
        "category": "swallowed-errors",
        "severity": "medium",
        "confidence": "high",
        "lens": "observability",
        "summary": "Multiple operations swallow errors silently without generating logs or telemetry. This conceals failures in quota file reading, worktree management, and file hashing.",
        "affected_files": [
          {"path": "packages/remediate-code/src/steps/waveScheduler.ts", "symbol": "scheduleWave"},
          {"path": "packages/remediate-code/src/steps/worktreeIsolation.ts", "symbol": "removeWorktree"},
          {"path": "packages/remediate-code/src/utils/fileIntegrity.ts", "symbol": "hashFile"}
        ],
        "evidence": [
          "packages/remediate-code/src/steps/waveScheduler.ts - `catch { // Best-effort: proceed without learned state }` in `scheduleWave` drops `readQuotaState` errors without recording the telemetry that quota persistence failed.",
          "packages/remediate-code/src/steps/worktreeIsolation.ts - Catch blocks like `catch { /* best effort */ }` and `catch { /* branch might not exist */ }` suppress potential edge cases during worktree creation and removal, dropping diagnostics from trace logs.",
          "packages/remediate-code/src/utils/fileIntegrity.ts - `hashFileSync` and `hashFile` silently return `undefined` on catch, burying unexpected FS errors (like permission denied) that affect file hashing."
        ]
      }
    ]
  }
]
