[
  {
    "task_id": "packages-audit-code:correctness:part-11",
    "unit_id": "packages-audit-code",
    "pass_id": "pass:correctness",
    "lens": "correctness",
    "file_coverage": [{"path":"packages/audit-code/src/quota/discoveredLimits.ts","total_lines":108},{"path":"packages/audit-code/src/quota/headerExtraction.ts","total_lines":157},{"path":"packages/audit-code/src/quota/headerExtractors/claudeCodeHeaderExtractor.ts","total_lines":32},{"path":"packages/audit-code/src/quota/headerExtractors/genericHeaderExtractor.ts","total_lines":15},{"path":"packages/audit-code/src/quota/headerExtractors/index.ts","total_lines":18},{"path":"packages/audit-code/src/quota/hostLimits.ts","total_lines":21},{"path":"packages/audit-code/src/quota/index.ts","total_lines":103},{"path":"packages/audit-code/src/quota/probe.ts","total_lines":28},{"path":"packages/audit-code/src/quota/scheduler.ts","total_lines":201},{"path":"packages/audit-code/src/reporting/mergeFindings.ts","total_lines":355},{"path":"packages/audit-code/src/reporting/synthesis.ts","total_lines":313},{"path":"packages/audit-code/src/reporting/synthesisNarrativePrompt.ts","total_lines":70},{"path":"packages/audit-code/src/reporting/workBlocks.ts","total_lines":201},{"path":"packages/audit-code/src/supervisor/operatorHandoff.ts","total_lines":435},{"path":"packages/audit-code/src/supervisor/runLedger.ts","total_lines":175}],
    "findings": [
      {
        "id": "COR-001",
        "title": "Rate limits ignore 0 values",
        "category": "logic-error",
        "severity": "high",
        "confidence": "high",
        "lens": "correctness",
        "summary": "Header extractors ignore valid zero values for remaining rate limits, preventing correct quota exhaustion detection.",
        "affected_files": [{"path": "packages/audit-code/src/quota/headerExtraction.ts", "line_start": 44, "line_end": 47}, {"path": "packages/audit-code/src/quota/headerExtraction.ts", "line_start": 121, "line_end": 131}],
        "evidence": ["packages/audit-code/src/quota/headerExtraction.ts:46 - parseNumericValue returns null if n <= 0, causing remaining limits of 0 to be lost.", "packages/audit-code/src/quota/headerExtraction.ts:127 - The get function also requires n > 0."]
      },
      {
        "id": "COR-002",
        "title": "Reset interval of 0s fails to convert to ISO timestamp",
        "category": "logic-error",
        "severity": "medium",
        "confidence": "high",
        "lens": "correctness",
        "summary": "parseResetValue returns the raw string 0 instead of a computed timestamp when the reset interval is 0 seconds.",
        "affected_files": [{"path": "packages/audit-code/src/quota/headerExtraction.ts", "line_start": 31, "line_end": 42}],
        "evidence": ["packages/audit-code/src/quota/headerExtraction.ts:38 - Only processes seconds > 0, so 0s returns the string 0 which is not a valid date string."]
      },
      {
        "id": "COR-003",
        "title": "Findings deduplication fails on different primary paths",
        "category": "logic-error",
        "severity": "high",
        "confidence": "high",
        "lens": "correctness",
        "summary": "Deduplication algorithms group entirely by affected_files[0], causing identical findings with different initial file paths to skip comparison.",
        "affected_files": [{"path": "packages/audit-code/src/reporting/mergeFindings.ts", "line_start": 152, "line_end": 152}, {"path": "packages/audit-code/src/reporting/mergeFindings.ts", "line_start": 197, "line_end": 197}],
        "evidence": ["packages/audit-code/src/reporting/mergeFindings.ts:152 - deduplicateSameLens groups by primaryPath(finding).", "packages/audit-code/src/reporting/mergeFindings.ts:197 - deduplicateCrossLens groups by primaryPath(finding). Findings with same files but different orders will not match."]
      },
      {
        "id": "COR-004",
        "title": "absorbFinding drops impact and likelihood fields",
        "category": "data-loss",
        "severity": "medium",
        "confidence": "high",
        "lens": "correctness",
        "summary": "The absorbFinding method does not migrate impact or likelihood from the absorbed finding to the survivor.",
        "affected_files": [{"path": "packages/audit-code/src/reporting/mergeFindings.ts", "line_start": 122, "line_end": 134}],
        "evidence": ["packages/audit-code/src/reporting/mergeFindings.ts:130 - systemic and summary are updated, but impact and likelihood are ignored."]
      },
      {
        "id": "COR-005",
        "title": "computeDependencies forces alphabetical block ordering",
        "category": "logic-error",
        "severity": "high",
        "confidence": "high",
        "lens": "correctness",
        "summary": "Critical flow block dependencies are assigned alphabetically by block ID instead of preserving the execution order array.",
        "affected_files": [{"path": "packages/audit-code/src/reporting/workBlocks.ts", "line_start": 79, "line_end": 91}],
        "evidence": ["packages/audit-code/src/reporting/workBlocks.ts:87 - flowBlocks is converted to an array and sorted, forcing alphabetical dependency instead of paths order."]
      }
    ]
  },
  {
    "task_id": "packages-audit-code:correctness:part-12",
    "unit_id": "packages-audit-code",
    "pass_id": "pass:correctness",
    "lens": "correctness",
    "file_coverage": [{"path":"packages/audit-code/src/supervisor/sessionConfig.ts","total_lines":75},{"path":"packages/audit-code/src/types.ts","total_lines":124},{"path":"packages/audit-code/src/types/analyzerCapability.ts","total_lines":24},{"path":"packages/audit-code/src/types/artifactMetadata.ts","total_lines":9},{"path":"packages/audit-code/src/types/auditScope.ts","total_lines":45},{"path":"packages/audit-code/src/types/auditState.ts","total_lines":25},{"path":"packages/audit-code/src/types/designAssessment.ts","total_lines":8},{"path":"packages/audit-code/src/types/externalAnalyzer.ts","total_lines":48},{"path":"packages/audit-code/src/types/flowCoverage.ts","total_lines":21},{"path":"packages/audit-code/src/types/reviewPlanning.ts","total_lines":91},{"path":"packages/audit-code/src/types/runtimeValidation.ts","total_lines":55},{"path":"packages/audit-code/src/types/synthesisNarrative.ts","total_lines":13},{"path":"packages/audit-code/src/types/toolingManifest.ts","total_lines":7},{"path":"packages/audit-code/src/types/workerResult.ts","total_lines":18},{"path":"packages/audit-code/src/types/workerSession.ts","total_lines":39}],
    "findings": []
  }
]
