[
  {
    "task_id": "packages-remediate-code:correctness:part-3",
    "unit_id": "packages-remediate-code",
    "pass_id": "pass:correctness",
    "lens": "correctness",
    "file_coverage": [
      {"path":"packages/remediate-code/src/quota/hostLimits.ts","total_lines":21},
      {"path":"packages/remediate-code/src/quota/index.ts","total_lines":63},
      {"path":"packages/remediate-code/src/quota/probe.ts","total_lines":25},
      {"path":"packages/remediate-code/src/quota/scheduler.ts","total_lines":169},
      {"path":"packages/remediate-code/src/state/closingActions.ts","total_lines":11},
      {"path":"packages/remediate-code/src/state/store.ts","total_lines":184},
      {"path":"packages/remediate-code/src/state/types.ts","total_lines":110},
      {"path":"packages/remediate-code/src/steps/dispatch.ts","total_lines":766},
      {"path":"packages/remediate-code/src/steps/intakeResolver.ts","total_lines":270}
    ],
    "findings": [
      {
        "id": "COR-001",
        "title": "Reversed logic for overriding source manifest when input is supplied",
        "category": "logic-error",
        "severity": "high",
        "confidence": "high",
        "lens": "correctness",
        "summary": "The intakeResolver incorrectly discards the existing manifest when the user does NOT supply input (!inputResolution.supplied), instead of when the user DOES supply input.",
        "affected_files": [
          {"path": "packages/remediate-code/src/steps/intakeResolver.ts", "line_start": 59, "line_end": 62}
        ],
        "evidence": [
          "packages/remediate-code/src/steps/intakeResolver.ts:59 - `if (!inputResolution.supplied && manifest && inputResolution.existing.length > 0)` incorrectly checks `!inputResolution.supplied` to blow away `manifest`. If the user supplies an explicit input, the manifest should be recreated, but if they rely on defaults, the existing manifest should be preserved."
        ]
      }
    ]
  },
  {
    "task_id": "packages-remediate-code:correctness:part-4",
    "unit_id": "packages-remediate-code",
    "pass_id": "pass:correctness",
    "lens": "correctness",
    "file_coverage": [
      {"path":"packages/remediate-code/src/steps/nextStep.ts","total_lines":1461},
      {"path":"packages/remediate-code/src/steps/stepWriter.ts","total_lines":68},
      {"path":"packages/remediate-code/src/steps/types.ts","total_lines":133},
      {"path":"packages/remediate-code/src/steps/waveScheduler.ts","total_lines":149},
      {"path":"packages/remediate-code/src/steps/worktreeIsolation.ts","total_lines":138},
      {"path":"packages/remediate-code/src/types/disposition.ts","total_lines":17},
      {"path":"packages/remediate-code/src/types/externalAnalyzer.ts","total_lines":20},
      {"path":"packages/remediate-code/src/types/flows.ts","total_lines":19},
      {"path":"packages/remediate-code/src/types/graph.ts","total_lines":20},
      {"path":"packages/remediate-code/src/types/risk.ts","total_lines":10},
      {"path":"packages/remediate-code/src/types/runLedger.ts","total_lines":24},
      {"path":"packages/remediate-code/src/types/sessionConfig.ts","total_lines":94},
      {"path":"packages/remediate-code/src/types/surfaces.ts","total_lines":17},
      {"path":"packages/remediate-code/src/types/workerResult.ts","total_lines":33},
      {"path":"packages/remediate-code/src/types/workerSession.ts","total_lines":77}
    ],
    "findings": [
      {
        "id": "COR-002",
        "title": "Uncommitted worktree changes are ignored and destroyed during merge",
        "category": "logic-error",
        "severity": "critical",
        "confidence": "high",
        "lens": "correctness",
        "summary": "mergeWorktree merges the branch but fails to commit the unstaged working tree changes made by the worker first. Uncommitted changes are silently dropped when the worktree is deleted.",
        "affected_files": [
          {"path": "packages/remediate-code/src/steps/worktreeIsolation.ts", "line_start": 63, "line_end": 74}
        ],
        "evidence": [
          "packages/remediate-code/src/steps/worktreeIsolation.ts:63 - `git diff --stat HEAD branchName` only compares commits. Since the worker edited files but did not commit them, the branch has no commits.",
          "packages/remediate-code/src/steps/worktreeIsolation.ts:76 - `git merge --no-ff branchName` is run, which sees the branch is an ancestor of HEAD and merges nothing.",
          "packages/remediate-code/src/steps/worktreeIsolation.ts:80 - `removeWorktree` is called, which force-deletes the worktree, discarding all uncommitted changes."
        ]
      }
    ]
  }
]
