[
  {
    "task_id": "packages-remediate-code:observability:part-5",
    "unit_id": "packages-remediate-code",
    "pass_id": "pass:observability",
    "lens": "observability",
    "file_coverage": [
      {"path":"packages/remediate-code/src/validation/artifacts.ts","total_lines":415},
      {"path":"packages/remediate-code/src/validation/remediationState.ts","total_lines":345},
      {"path":"packages/remediate-code/tsconfig.json","total_lines":18},
      {"path":"packages/remediate-code/vitest.config.ts","total_lines":14}
    ],
    "findings": []
  },
  {
    "task_id": "packages-shared:observability:part-1",
    "unit_id": "packages-shared",
    "pass_id": "pass:observability",
    "lens": "observability",
    "file_coverage": [
      {"path":"packages/shared/package.json","total_lines":41},
      {"path":"packages/shared/src/contracts.ts","total_lines":2},
      {"path":"packages/shared/src/git.ts","total_lines":70},
      {"path":"packages/shared/src/index.ts","total_lines":241},
      {"path":"packages/shared/src/io/json.ts","total_lines":186},
      {"path":"packages/shared/src/observability/runLog.ts","total_lines":66},
      {"path":"packages/shared/src/providers/types.ts","total_lines":46},
      {"path":"packages/shared/src/quota/compositeQuotaSource.ts","total_lines":22},
      {"path":"packages/shared/src/quota/errorParsers/claudeCodeErrorParser.ts","total_lines":47},
      {"path":"packages/shared/src/quota/errorParsers/genericErrorParser.ts","total_lines":15},
      {"path":"packages/shared/src/quota/errorParsers/index.ts","total_lines":18},
      {"path":"packages/shared/src/quota/errorParsing.ts","total_lines":85},
      {"path":"packages/shared/src/quota/fileLock.ts","total_lines":74},
      {"path":"packages/shared/src/quota/hostLimits.ts","total_lines":71},
      {"path":"packages/shared/src/quota/learnedQuotaSource.ts","total_lines":32}
    ],
    "findings": [
      {
        "id": "OBS-GIT-001",
        "title": "Silent git failures hide issues",
        "category": "missing-telemetry",
        "severity": "medium",
        "confidence": "high",
        "lens": "observability",
        "summary": "gitLines silently degrades to returning an empty array on non-zero exit, lacking telemetry or context for why a git command failed.",
        "affected_files": [
          {
            "path": "packages/shared/src/git.ts",
            "line_start": 11,
            "line_end": 16,
            "symbol": "gitLines"
          }
        ],
        "evidence": [
          "packages/shared/src/git.ts:13 - `if (result.status !== 0) return [];` swallows the error completely without any log or trace, making it impossible to observe git failures."
        ]
      },
      {
        "id": "OBS-QUOTA-001",
        "title": "Silent failures in composite quota source",
        "category": "missing-telemetry",
        "severity": "medium",
        "confidence": "high",
        "lens": "observability",
        "summary": "The composite quota source catches and ignores errors when querying a quota source, making it hard to track source failures.",
        "affected_files": [
          {
            "path": "packages/shared/src/quota/compositeQuotaSource.ts",
            "line_start": 12,
            "line_end": 20,
            "symbol": "queryCurrentUsage"
          }
        ],
        "evidence": [
          "packages/shared/src/quota/compositeQuotaSource.ts:16 - `catch { // Skip failing sources, try next }` suppresses any telemetry or logging about which source failed and why."
        ]
      }
    ]
  },
  {
    "task_id": "packages-shared:observability:part-2",
    "unit_id": "packages-shared",
    "pass_id": "pass:observability",
    "lens": "observability",
    "file_coverage": [
      {"path":"packages/shared/src/quota/limits.ts","total_lines":91},
      {"path":"packages/shared/src/quota/quotaSource.ts","total_lines":13},
      {"path":"packages/shared/src/quota/slidingWindow.ts","total_lines":39},
      {"path":"packages/shared/src/quota/state.ts","total_lines":198},
      {"path":"packages/shared/src/quota/types.ts","total_lines":72},
      {"path":"packages/shared/src/tooling/analyzerDeps.ts","total_lines":176},
      {"path":"packages/shared/src/tooling/exec.ts","total_lines":160},
      {"path":"packages/shared/src/tooling/repoConventions.ts","total_lines":208},
      {"path":"packages/shared/src/types/accessDeclaration.ts","total_lines":5},
      {"path":"packages/shared/src/types/disposition.ts","total_lines":17},
      {"path":"packages/shared/src/types/finding.ts","total_lines":93},
      {"path":"packages/shared/src/types/flows.ts","total_lines":19},
      {"path":"packages/shared/src/types/graph.ts","total_lines":30},
      {"path":"packages/shared/src/types/remediationOutcome.ts","total_lines":33},
      {"path":"packages/shared/src/types/risk.ts","total_lines":10}
    ],
    "findings": [
      {
        "id": "OBS-REPO-001",
        "title": "Silenced IO errors in repoConventions",
        "category": "missing-telemetry",
        "severity": "medium",
        "confidence": "high",
        "lens": "observability",
        "summary": "File reading and JSON parsing errors are caught and swallowed without logging, returning undefined.",
        "affected_files": [
          {
            "path": "packages/shared/src/tooling/repoConventions.ts",
            "line_start": 27,
            "line_end": 41,
            "symbol": "readJson/readText"
          }
        ],
        "evidence": [
          "packages/shared/src/tooling/repoConventions.ts:30 - `catch { return undefined; }` swallows JSON parse errors, hiding invalid config files from observability."
        ]
      },
      {
        "id": "OBS-STATE-001",
        "title": "Unstructured stderr logging in quota state",
        "category": "logging-quality",
        "severity": "low",
        "confidence": "high",
        "lens": "observability",
        "summary": "The quota state module writes errors directly to process.stderr instead of using structured logging or telemetry.",
        "affected_files": [
          {
            "path": "packages/shared/src/quota/state.ts",
            "line_start": 65,
            "line_end": 75,
            "symbol": "readState"
          }
        ],
        "evidence": [
          "packages/shared/src/quota/state.ts:66 - `process.stderr.write('[quota] ignoring invalid quota state...')` is unstructured and may not be captured by standard observability pipelines."
        ]
      }
    ]
  },
  {
    "task_id": "packages-shared:observability:part-3",
    "unit_id": "packages-shared",
    "pass_id": "pass:observability",
    "lens": "observability",
    "file_coverage": [
      {"path":"packages/shared/src/types/runLedger.ts","total_lines":24},
      {"path":"packages/shared/src/types/stepContract.ts","total_lines":8},
      {"path":"packages/shared/src/types/surfaces.ts","total_lines":17},
      {"path":"packages/shared/src/validation/basic.ts","total_lines":82},
      {"path":"packages/shared/tsconfig.json","total_lines":9}
    ],
    "findings": []
  },
  {
    "task_id": "root-config:observability",
    "unit_id": "root-config",
    "pass_id": "pass:observability",
    "lens": "observability",
    "file_coverage": [
      {"path":"opencode.json","total_lines":123},
      {"path":"package.json","total_lines":19},
      {"path":"remediation-outcomes.json","total_lines":74},
      {"path":"remediation-report.json","total_lines":40},
      {"path":"tsconfig.base.json","total_lines":15}
    ],
    "findings": []
  },
  {
    "task_id": "tests-tiny-files:observability",
    "unit_id": "tests-tiny-files",
    "pass_id": "pass:observability",
    "lens": "observability",
    "file_coverage": [
      {"path":"packages/audit-code/tests/graph-framework-routes.test.mjs","total_lines":173},
      {"path":"packages/audit-code/tests/quota-file-lock.test.mjs","total_lines":93},
      {"path":"packages/audit-code/tests/render-worker-prompt.test.mjs","total_lines":115},
      {"path":"packages/remediate-code/tests/quota-file-lock.test.ts","total_lines":65}
    ],
    "findings": []
  }
]
