[
  {
    "task_id": "packages-audit-code:tests:part-12",
    "unit_id": "packages-audit-code",
    "pass_id": "pass:tests",
    "lens": "tests",
    "file_coverage": [
      {"path":"packages/audit-code/src/providers/spawnLoggedCommand.ts","total_lines":242},
      {"path":"packages/audit-code/src/providers/subprocessTemplateProvider.ts","total_lines":64},
      {"path":"packages/audit-code/src/providers/vscodeTaskProvider.ts","total_lines":22},
      {"path":"packages/audit-code/src/quota/discoveredLimits.ts","total_lines":108},
      {"path":"packages/audit-code/src/quota/headerExtraction.ts","total_lines":157},
      {"path":"packages/audit-code/src/quota/headerExtractors/claudeCodeHeaderExtractor.ts","total_lines":32},
      {"path":"packages/audit-code/src/quota/headerExtractors/genericHeaderExtractor.ts","total_lines":15},
      {"path":"packages/audit-code/src/quota/headerExtractors/index.ts","total_lines":18},
      {"path":"packages/audit-code/src/quota/hostLimits.ts","total_lines":21},
      {"path":"packages/audit-code/src/quota/index.ts","total_lines":103},
      {"path":"packages/audit-code/src/quota/probe.ts","total_lines":28},
      {"path":"packages/audit-code/src/quota/scheduler.ts","total_lines":201},
      {"path":"packages/audit-code/src/reporting/mergeFindings.ts","total_lines":355},
      {"path":"packages/audit-code/src/reporting/synthesis.ts","total_lines":313},
      {"path":"packages/audit-code/src/reporting/synthesisNarrativePrompt.ts","total_lines":70}
    ],
    "findings": [
      {
        "id": "COV-001",
        "title": "Missing test coverage for SubprocessTemplateProvider",
        "category": "test-coverage",
        "severity": "high",
        "confidence": "high",
        "lens": "tests",
        "summary": "The subprocessTemplateProvider source file has no corresponding test coverage.",
        "affected_files": [
          { "path": "packages/audit-code/src/providers/subprocessTemplateProvider.ts" }
        ],
        "evidence": [
          "packages/audit-code/src/providers/subprocessTemplateProvider.ts:1 - No tests found in the tests directory covering this provider logic."
        ]
      },
      {
        "id": "COV-002",
        "title": "Missing test coverage for vscodeTaskProvider",
        "category": "test-coverage",
        "severity": "high",
        "confidence": "high",
        "lens": "tests",
        "summary": "The vscodeTaskProvider source file has no corresponding test coverage.",
        "affected_files": [
          { "path": "packages/audit-code/src/providers/vscodeTaskProvider.ts" }
        ],
        "evidence": [
          "packages/audit-code/src/providers/vscodeTaskProvider.ts:1 - No tests found in the tests directory covering this provider logic."
        ]
      },
      {
        "id": "COV-003",
        "title": "Missing test coverage for ClaudeCodeHeaderExtractor",
        "category": "test-coverage",
        "severity": "high",
        "confidence": "high",
        "lens": "tests",
        "summary": "The claudeCodeHeaderExtractor source file lacks test coverage.",
        "affected_files": [
          { "path": "packages/audit-code/src/quota/headerExtractors/claudeCodeHeaderExtractor.ts" }
        ],
        "evidence": [
          "packages/audit-code/src/quota/headerExtractors/claudeCodeHeaderExtractor.ts:1 - No dedicated tests found for this extractor."
        ]
      },
      {
        "id": "COV-004",
        "title": "Missing test coverage for genericHeaderExtractor",
        "category": "test-coverage",
        "severity": "high",
        "confidence": "high",
        "lens": "tests",
        "summary": "The genericHeaderExtractor source file lacks test coverage.",
        "affected_files": [
          { "path": "packages/audit-code/src/quota/headerExtractors/genericHeaderExtractor.ts" }
        ],
        "evidence": [
          "packages/audit-code/src/quota/headerExtractors/genericHeaderExtractor.ts:1 - No dedicated tests found for this extractor."
        ]
      }
    ]
  },
  {
    "task_id": "packages-audit-code:tests:part-13",
    "unit_id": "packages-audit-code",
    "pass_id": "pass:tests",
    "lens": "tests",
    "file_coverage": [
      {"path":"packages/audit-code/src/reporting/workBlocks.ts","total_lines":201},
      {"path":"packages/audit-code/src/supervisor/operatorHandoff.ts","total_lines":435},
      {"path":"packages/audit-code/src/supervisor/runLedger.ts","total_lines":175},
      {"path":"packages/audit-code/src/supervisor/sessionConfig.ts","total_lines":75},
      {"path":"packages/audit-code/src/types.ts","total_lines":124},
      {"path":"packages/audit-code/src/types/analyzerCapability.ts","total_lines":24},
      {"path":"packages/audit-code/src/types/artifactMetadata.ts","total_lines":9},
      {"path":"packages/audit-code/src/types/auditScope.ts","total_lines":45},
      {"path":"packages/audit-code/src/types/auditState.ts","total_lines":25},
      {"path":"packages/audit-code/src/types/designAssessment.ts","total_lines":8},
      {"path":"packages/audit-code/src/types/externalAnalyzer.ts","total_lines":48},
      {"path":"packages/audit-code/src/types/flowCoverage.ts","total_lines":21},
      {"path":"packages/audit-code/src/types/reviewPlanning.ts","total_lines":91},
      {"path":"packages/audit-code/src/types/runtimeValidation.ts","total_lines":55},
      {"path":"packages/audit-code/src/types/synthesisNarrative.ts","total_lines":13}
    ],
    "findings": [
      {
        "id": "COV-005",
        "title": "Insufficient test coverage for complex graph algorithms in workBlocks",
        "category": "test-coverage",
        "severity": "medium",
        "confidence": "high",
        "lens": "tests",
        "summary": "The workBlocks module contains complex logic like union-find grouping and graph dependency resolution, but lacks dedicated unit tests covering edge cases.",
        "affected_files": [
          { "path": "packages/audit-code/src/reporting/workBlocks.ts" }
        ],
        "evidence": [
          "packages/audit-code/src/reporting/workBlocks.ts:50 - The computeDependencies function resolves graph edges but is only tangentially covered by synthesis tests.",
          "packages/audit-code/src/reporting/workBlocks.ts:113 - The union-find grouping algorithm (find/union) has no tests asserting incorrect behavior or edge cases."
        ]
      }
    ]
  }
]
