[
  {
    "task_id": "packages-audit-code:tests:part-19",
    "unit_id": "packages-audit-code",
    "pass_id": "pass:tests",
    "lens": "tests",
    "file_coverage": [
      {"path":"packages/audit-code/tests/review-packets.test.mjs","total_lines":1306},
      {"path":"packages/audit-code/tests/schema-contracts.test.mjs","total_lines":1099},
      {"path":"packages/audit-code/tests/scope.test.mjs","total_lines":287},
      {"path":"packages/audit-code/tests/supervisor-remediation.test.mjs","total_lines":292}
    ],
    "findings": [
      {
        "id": "TST-001",
        "title": "Tests import compiled dist/ files instead of source",
        "category": "stale-build-import",
        "severity": "medium",
        "confidence": "high",
        "lens": "tests",
        "summary": "The test files import modules from the compiled dist/ directory, which causes them to silently pass on stale builds instead of testing the actual source code.",
        "affected_files": [
          {"path": "packages/audit-code/tests/review-packets.test.mjs", "line_start": 15, "line_end": 19},
          {"path": "packages/audit-code/tests/schema-contracts.test.mjs", "line_start": 11, "line_end": 21},
          {"path": "packages/audit-code/tests/scope.test.mjs", "line_start": 13, "line_end": 13},
          {"path": "packages/audit-code/tests/supervisor-remediation.test.mjs", "line_start": 7, "line_end": 13}
        ],
        "evidence": [
          "packages/audit-code/tests/review-packets.test.mjs:15 - Imports from '../dist/orchestrator/reviewPackets.js'",
          "packages/audit-code/tests/schema-contracts.test.mjs:11 - Imports from '../dist/orchestrator/unitBuilder.js'",
          "packages/audit-code/tests/scope.test.mjs:13 - Imports from '../dist/orchestrator/scope.js'",
          "packages/audit-code/tests/supervisor-remediation.test.mjs:7 - Imports from '../dist/supervisor/operatorHandoff.js'"
        ]
      }
    ]
  },
  {
    "task_id": "packages-audit-code:tests:part-2",
    "unit_id": "packages-audit-code",
    "pass_id": "pass:tests",
    "lens": "tests",
    "file_coverage": [
      {"path":"packages/audit-code/dispatch/merge-results.mjs","total_lines":82},
      {"path":"packages/audit-code/dispatch/validate-result.mjs","total_lines":57},
      {"path":"packages/audit-code/dispatch/validate.mjs","total_lines":16},
      {"path":"packages/audit-code/skills/audit-code/opencode-command-template.txt","total_lines":13},
      {"path":"packages/audit-code/src/adapters/coverageSummary.ts","total_lines":26},
      {"path":"packages/audit-code/src/adapters/eslint.ts","total_lines":49},
      {"path":"packages/audit-code/src/adapters/normalizeExternal.ts","total_lines":34},
      {"path":"packages/audit-code/src/adapters/npmAudit.ts","total_lines":30},
      {"path":"packages/audit-code/src/adapters/semgrep.ts","total_lines":35}
    ],
    "findings": [
      {
        "id": "TST-002",
        "title": "Missing test coverage for dispatch and adapter scripts",
        "category": "missing-tests",
        "severity": "medium",
        "confidence": "high",
        "lens": "tests",
        "summary": "The dispatch scripts (merge-results.mjs, validate-result.mjs, validate.mjs) and the normalizeExternal.ts adapter utility have no dedicated tests in the test suite.",
        "affected_files": [
          {"path": "packages/audit-code/dispatch/merge-results.mjs"},
          {"path": "packages/audit-code/dispatch/validate-result.mjs"},
          {"path": "packages/audit-code/dispatch/validate.mjs"},
          {"path": "packages/audit-code/src/adapters/normalizeExternal.ts"}
        ],
        "evidence": [
          "packages/audit-code/dispatch/merge-results.mjs:1 - Entire file lacks test coverage, verified by grep search for 'merge-results' in tests directory yielding no results.",
          "packages/audit-code/dispatch/validate-result.mjs:1 - Entire file lacks test coverage.",
          "packages/audit-code/dispatch/validate.mjs:1 - Entire file lacks test coverage.",
          "packages/audit-code/src/adapters/normalizeExternal.ts:1 - Entire file lacks test coverage."
        ]
      }
    ]
  },
  {
    "task_id": "packages-audit-code:tests:part-20",
    "unit_id": "packages-audit-code",
    "pass_id": "pass:tests",
    "lens": "tests",
    "file_coverage": [
      {"path":"packages/audit-code/tests/validate-command.test.mjs","total_lines":324},
      {"path":"packages/audit-code/tests/validation-remediation.test.mjs","total_lines":465}
    ],
    "findings": [
      {
        "id": "TST-003",
        "title": "Tests import compiled dist/ files instead of source",
        "category": "stale-build-import",
        "severity": "medium",
        "confidence": "high",
        "lens": "tests",
        "summary": "The test files import modules and CLI scripts from the compiled dist/ directory, which causes them to silently pass on stale builds instead of testing the actual source code.",
        "affected_files": [
          {"path": "packages/audit-code/tests/validate-command.test.mjs", "line_start": 9, "line_end": 10},
          {"path": "packages/audit-code/tests/validation-remediation.test.mjs", "line_start": 9, "line_end": 16}
        ],
        "evidence": [
          "packages/audit-code/tests/validate-command.test.mjs:9 - Dynamically resolves and imports from '../dist/cli.js'",
          "packages/audit-code/tests/validation-remediation.test.mjs:9 - Imports from '../dist/validation/artifacts.js'"
        ]
      }
    ]
  }
]
